{
  "task_id": "review_69a9990da9fb4a59",
  "snapshot_hash": "4cd6ae2ffae02c344e95de68afca7b579a8b3c77465471ded8b2d56a9af46aee",
  "reviewer_id": "independent-demo-reviewer",
  "review_source": "subagent",
  "status": "PASS",
  "scope": "P1 only: inspected actual model, data, solver, CSV, reproduction manifest and persisted successful run logs; reran copied source/data in a separate temporary directory and checked every bound, absolute errors <=1e-9, byte-identical CSV and independent optimality proof. This review does not approve figures or paper.",
  "evidence": [
    {
      "path": "solver.py",
      "sha256": "164b5acaf56fccad3df2858b1a17fd6d6ed9d1079c7ce0a454c9a3eb29a18d58",
      "locator": "Actual file SHA verified; model/data/source/results/manifest checked against isolated independent rerun."
    },
    {
      "path": "术语表格.md",
      "sha256": "022a00d288275d4c5cb663d3f72b86c74b4276751ac17c84b3e329057cf6f458",
      "locator": "Actual file SHA verified; model/data/source/results/manifest checked against isolated independent rerun."
    },
    {
      "path": "题目分析报告.md",
      "sha256": "e7326a40c73896f3fdc02460ba63bfd58b129f785179d082d1f0e0ca5a8f6eb4",
      "locator": "Actual file SHA verified; model/data/source/results/manifest checked against isolated independent rerun."
    },
    {
      "path": "data/case.json",
      "sha256": "18ee5a359c5968aa76d5ac32100b66bed91354090906a3886bed2a8b45672040",
      "locator": "Actual file SHA verified; model/data/source/results/manifest checked against isolated independent rerun."
    },
    {
      "path": "results/solution.csv",
      "sha256": "9a055c9630db44647a2a87a1bba9f2dbbdeef7e5371a9998b8a9d53bb9636d9d",
      "locator": "Actual file SHA verified; model/data/source/results/manifest checked against isolated independent rerun."
    },
    {
      "path": "results/复现清单.json",
      "sha256": "d32a9990513eff914a8b0ae7a1c830b5de7f05ec1e8e0980550013fb6dffbd58",
      "locator": "Actual file SHA verified; model/data/source/results/manifest checked against isolated independent rerun."
    }
  ],
  "findings": [
    {
      "level": "P2",
      "text": "The current minimum-run manifest records dependencies as an empty mapping. Record actual numpy/scipy (and matplotlib when figures run) versions before final programming/environment freeze."
    },
    {
      "level": "P2",
      "text": "solver.py assert_allclose retains default relative tolerance because rtol is omitted. Set rtol=0 if the stated 1e-9 comparison is intended as an absolute tolerance. Independent review checked actual absolute errors and found all zero."
    }
  ],
  "rework": ""
}
