{
  "task_id": "review_7f7a64ab5495471d",
  "snapshot_hash": "4fa0b9aadac05e90f00e6c66da8eedef87b8135ddd1608eea1c45944378d46c7",
  "reviewer_id": "independent-demo-reviewer",
  "review_source": "subagent",
  "status": "PASS",
  "scope": "P2 under strengthened execution contract: reverified every current file SHA and all artifact bindings against the same independently rerun and visually inspected source/input/CSV/PNG/SVG/manifest. Verified newly added run_bindings, including actual argv, absolute executable, observed environment, seed, parameters and successful source/output records against persisted execution and the newly reprobed P1 environment. No source or output bytes changed since independent P2 rerun/visual inspection, so those actual observations remain applicable. This review is limited to the deterministic synthetic model and does not approve paper.",
  "evidence": [
    {
      "path": "solver.py",
      "sha256": "26c4082c7cb9307f8073ecb866ec33688204f869fa202cb11197f7e411ea16c3",
      "locator": "Actual SHA unchanged from independent full solver rerun and PNG visual inspection; run/artifact bindings rechecked."
    },
    {
      "path": "术语表格.md",
      "sha256": "022a00d288275d4c5cb663d3f72b86c74b4276751ac17c84b3e329057cf6f458",
      "locator": "Actual SHA unchanged from independent full solver rerun and PNG visual inspection; run/artifact bindings rechecked."
    },
    {
      "path": "题目分析报告.md",
      "sha256": "e7326a40c73896f3fdc02460ba63bfd58b129f785179d082d1f0e0ca5a8f6eb4",
      "locator": "Actual SHA unchanged from independent full solver rerun and PNG visual inspection; run/artifact bindings rechecked."
    },
    {
      "path": "data/case.json",
      "sha256": "18ee5a359c5968aa76d5ac32100b66bed91354090906a3886bed2a8b45672040",
      "locator": "Actual SHA unchanged from independent full solver rerun and PNG visual inspection; run/artifact bindings rechecked."
    },
    {
      "path": "figures/result_q1_region.png",
      "sha256": "ed4a0a131098dcbde5d2d264b5a7b8f3f4d5f1d18ac4e54ba556c270944125a8",
      "locator": "Actual SHA unchanged from independent full solver rerun and PNG visual inspection; run/artifact bindings rechecked."
    },
    {
      "path": "figures/result_q1_region.svg",
      "sha256": "f6beaef5fd707c14345596f47f0182723460927159f42e3c710f7776dc077e15",
      "locator": "Actual SHA unchanged from independent full solver rerun and PNG visual inspection; run/artifact bindings rechecked."
    },
    {
      "path": "figures/result_q1_usage.png",
      "sha256": "8e07e7f4a7d617acd18ebd21f889db0e2e849cd16fc54f19b09e7f6dce000cdd",
      "locator": "Actual SHA unchanged from independent full solver rerun and PNG visual inspection; run/artifact bindings rechecked."
    },
    {
      "path": "figures/result_q1_usage.svg",
      "sha256": "26e9dc5350c342d75e5ac450d946c25ec88e8b3c3b873fd3414ac1932736273d",
      "locator": "Actual SHA unchanged from independent full solver rerun and PNG visual inspection; run/artifact bindings rechecked."
    },
    {
      "path": "results/solution.csv",
      "sha256": "9a055c9630db44647a2a87a1bba9f2dbbdeef7e5371a9998b8a9d53bb9636d9d",
      "locator": "Actual SHA unchanged from independent full solver rerun and PNG visual inspection; run/artifact bindings rechecked."
    },
    {
      "path": "results/复现清单.json",
      "sha256": "2eace1a361f8c17348c922e51c76c77b48660088f3fbe656b0a87596a50f89ed",
      "locator": "Actual SHA unchanged from independent full solver rerun and PNG visual inspection; run/artifact bindings rechecked."
    }
  ],
  "findings": [],
  "rework": ""
}
