{
  "task_id": "review_e31b875496c34f13",
  "snapshot_hash": "71783cebb05ed589184c1a49d47c3987c3dfa60ead83d1a1cde6854c99b9ec58",
  "reviewer_id": "independent-demo-reviewer",
  "review_source": "subagent",
  "status": "PASS",
  "scope": "P1 only: new minimal_run_id and snapshot verified from actual files. Inspected updated source, model and input; strict rtol=0 and all constraints are asserted. Independently reran copied source/data outside project, verified byte-identical CSV, zero absolute errors and nonpositive residuals, exact optimality proof, persisted successful logs and observed Python/numpy/scipy/matplotlib versions. Earlier P2 suggestions are resolved for this execution. Figures and paper are not approved by this receipt.",
  "evidence": [
    {
      "path": "solver.py",
      "sha256": "26c4082c7cb9307f8073ecb866ec33688204f869fa202cb11197f7e411ea16c3",
      "locator": "Actual snapshot SHA; source/model/input/result cross-checked by independent isolated rerun."
    },
    {
      "path": "术语表格.md",
      "sha256": "022a00d288275d4c5cb663d3f72b86c74b4276751ac17c84b3e329057cf6f458",
      "locator": "Actual snapshot SHA; source/model/input/result cross-checked by independent isolated rerun."
    },
    {
      "path": "题目分析报告.md",
      "sha256": "e7326a40c73896f3fdc02460ba63bfd58b129f785179d082d1f0e0ca5a8f6eb4",
      "locator": "Actual snapshot SHA; source/model/input/result cross-checked by independent isolated rerun."
    },
    {
      "path": "data/case.json",
      "sha256": "18ee5a359c5968aa76d5ac32100b66bed91354090906a3886bed2a8b45672040",
      "locator": "Actual snapshot SHA; source/model/input/result cross-checked by independent isolated rerun."
    },
    {
      "path": "results/solution.csv",
      "sha256": "9a055c9630db44647a2a87a1bba9f2dbbdeef7e5371a9998b8a9d53bb9636d9d",
      "locator": "Actual snapshot SHA; source/model/input/result cross-checked by independent isolated rerun."
    }
  ],
  "findings": [],
  "rework": ""
}
