{
  "task_id": "review_4a04629632594009",
  "snapshot_hash": "2d57570a7eab01e982b4dfdd65a2a42091c286142fa8346b67eb224f288f2264",
  "reviewer_id": "independent-demo-reviewer",
  "review_source": "subagent",
  "status": "PASS",
  "scope": "W2 final synthetic report: viewed both actual rendered pages and checked equations, unique-optimum proof, numeric table, two figures, captions, units, binding/slack interpretation and explicit limitations. Matched all source/input/output hashes and run bindings, actual direct XeLaTeX compilation, environment probes, and current PDF-to-render input bindings. Independently copied the registered TeX and figure inputs outside the project, recompiled with the same direct executable and rendered both pages with Poppler; resulting page PNGs match registered renders byte-for-byte. No compiler warnings, placeholders, clipped/overlapping content, invented references or unsupported real-world conclusions found. Approval is limited to this deterministic two-variable workflow verification report.",
  "evidence": [
    {
      "path": "build_demo_paper.py",
      "sha256": "a58201ccc52ef8a8935e24edffa006e7e26191794e7ac3172efcde26256627a6",
      "locator": "Actual SHA verified; paper claims and direct compile/render provenance checked against source and underlying independently solved case."
    },
    {
      "path": "paper.tex",
      "sha256": "1e91ce5db2e4354b23dab30027b69990c033e689e94c2daa84c4e4e2cc3c4fa0",
      "locator": "Actual SHA verified; paper claims and direct compile/render provenance checked against source and underlying independently solved case."
    },
    {
      "path": "render_demo.py",
      "sha256": "e5a1f6b60ba61ca8de8fb86e75552061e6dc59176e7cf36707d5986a3298328f",
      "locator": "Actual SHA verified; paper claims and direct compile/render provenance checked against source and underlying independently solved case."
    },
    {
      "path": "solver.py",
      "sha256": "26c4082c7cb9307f8073ecb866ec33688204f869fa202cb11197f7e411ea16c3",
      "locator": "Actual SHA verified; paper claims and direct compile/render provenance checked against source and underlying independently solved case."
    },
    {
      "path": "完整论文.pdf",
      "sha256": "611b5d6759d19d5635d315a8b25b30c47a8d2e45b57cbee4478ae6b804096fd4",
      "locator": "Actual SHA verified; paper claims and direct compile/render provenance checked against source and underlying independently solved case."
    },
    {
      "path": "术语表格.md",
      "sha256": "022a00d288275d4c5cb663d3f72b86c74b4276751ac17c84b3e329057cf6f458",
      "locator": "Actual SHA verified; paper claims and direct compile/render provenance checked against source and underlying independently solved case."
    },
    {
      "path": "论文大纲.md",
      "sha256": "9b3b61191037afe708ea7ba3a4a9f374ed2a77a325d07b880385d93f7bd56d55",
      "locator": "Actual SHA verified; paper claims and direct compile/render provenance checked against source and underlying independently solved case."
    },
    {
      "path": "题目分析报告.md",
      "sha256": "e7326a40c73896f3fdc02460ba63bfd58b129f785179d082d1f0e0ca5a8f6eb4",
      "locator": "Actual SHA verified; paper claims and direct compile/render provenance checked against source and underlying independently solved case."
    },
    {
      "path": "data/case.json",
      "sha256": "18ee5a359c5968aa76d5ac32100b66bed91354090906a3886bed2a8b45672040",
      "locator": "Actual SHA verified; paper claims and direct compile/render provenance checked against source and underlying independently solved case."
    },
    {
      "path": "figures/result_q1_region.png",
      "sha256": "ed4a0a131098dcbde5d2d264b5a7b8f3f4d5f1d18ac4e54ba556c270944125a8",
      "locator": "Actual SHA verified; paper claims and direct compile/render provenance checked against source and underlying independently solved case."
    },
    {
      "path": "figures/result_q1_region.svg",
      "sha256": "f6beaef5fd707c14345596f47f0182723460927159f42e3c710f7776dc077e15",
      "locator": "Actual SHA verified; paper claims and direct compile/render provenance checked against source and underlying independently solved case."
    },
    {
      "path": "figures/result_q1_usage.png",
      "sha256": "8e07e7f4a7d617acd18ebd21f889db0e2e849cd16fc54f19b09e7f6dce000cdd",
      "locator": "Actual SHA verified; paper claims and direct compile/render provenance checked against source and underlying independently solved case."
    },
    {
      "path": "figures/result_q1_usage.svg",
      "sha256": "26e9dc5350c342d75e5ac450d946c25ec88e8b3c3b873fd3414ac1932736273d",
      "locator": "Actual SHA verified; paper claims and direct compile/render provenance checked against source and underlying independently solved case."
    },
    {
      "path": "render/page-1.png",
      "sha256": "8935338019dc19c54926d49a1bdb7c5c5cc4a7a4ca7dbe797ab2801f65d314dc",
      "locator": "Entire actual rendered page viewed; independently recompiled/rendered byte-identical."
    },
    {
      "path": "render/page-2.png",
      "sha256": "9a4d106501bd0d45fe0878e819f761ea53cdd9880eb8c1fe993e5ec19780b1d5",
      "locator": "Entire actual rendered page viewed; independently recompiled/rendered byte-identical."
    },
    {
      "path": "results/solution.csv",
      "sha256": "9a055c9630db44647a2a87a1bba9f2dbbdeef7e5371a9998b8a9d53bb9636d9d",
      "locator": "Actual SHA verified; paper claims and direct compile/render provenance checked against source and underlying independently solved case."
    },
    {
      "path": "results/复现清单.json",
      "sha256": "2eace1a361f8c17348c922e51c76c77b48660088f3fbe656b0a87596a50f89ed",
      "locator": "Actual SHA verified; paper claims and direct compile/render provenance checked against source and underlying independently solved case."
    }
  ],
  "findings": [],
  "rework": ""
}
